description,insurance_type,claim_type,severity,department
По първоначална информация Настъпила е смърт вследствие на злополука.,Accident,Death benefit,Critical,Accident Claims
По първоначална информация Пострадалият не може да работи временно след травма. Налични са снимки на увредените части.,Accident,Temporary disability,Medium,Accident Claims
Пожар е унищожил купето на автомобила. Подадено е уведомление към застрахователя.,Auto,Fire,Critical,Motor Claims
"Клиентът съобщава, че Сградата е получила конструктивни повреди след трус. Подадено е уведомление към застрахователя.",Property,Earthquake,High,Property Claims
Настъпила е смърт вследствие на злополука. Необходима е допълнителна проверка на обстоятелствата.,Accident,Death benefit,Critical,Accident Claims
"В уведомлението е посочено, че Клиентът е приет по спешност след внезапно влошаване.",Health,Emergency treatment,Critical,Health Claims
"Клиентът съобщава, че След теч от тръба е повреден ламинатът. Налични са снимки на увредените части.",Property,Burst pipe,High,Property Claims
От жилището са откраднати техника и лични вещи. Необходима е допълнителна проверка на обстоятелствата.,Property,Theft,High,Property Claims
"Клиентът съобщава, че След сблъсък между два автомобила има щети по калника и фара.",Auto,Collision,Medium,Motor Claims
"Клиентът съобщава, че Трето лице е пострадало по вина на застрахования.",Liability,Bodily injury,High,Liability Claims
"В уведомлението е посочено, че Сградата е получила конструктивни повреди след трус. Налични са снимки на увредените части.",Property,Earthquake,High,Property Claims
По първоначална информация Токов удар е повредил телевизор и компютър. Клиентът представя документи за събитието.,Property,Electrical damage,Low,Property Claims
"Клиентът съобщава, че Клиентът иска възстановяване на разходи за лекарства.",Health,Medication reimbursement,Medium,Health Claims
По първоначална информация Счупено е огледало и има следи от вандализъм. Налични са снимки на увредените части.,Auto,Vandalism,Low,Motor Claims
След силна буря има паднали клони върху покрива.,Property,Storm,Medium,Property Claims
"В уведомлението е посочено, че Автомобилът е ударен отзад в Пловдив и има повреди по бронята. Подадено е уведомление към застрахователя.",Auto,Collision,High,Motor Claims
"Клиентът съобщава, че Извършено е амбулаторно лечение. Подадено е уведомление към застрахователя.",Health,Outpatient treatment,Medium,Health Claims
"В уведомлението е посочено, че Счупено е страничното стъкло на автомобила. Налични са снимки на увредените части.",Auto,Glass damage,Low,Motor Claims
Има пукнатина на челното стъкло след удар от предмет. Клиентът представя документи за събитието.,Auto,Glass damage,Medium,Motor Claims
По първоначална информация Застрахованият е причинил щети на чуждо имущество.,Liability,Property damage,High,Liability Claims
По първоначална информация Токов удар е повредил телевизор и компютър. Клиентът представя документи за събитието.,Property,Electrical damage,Low,Property Claims
По първоначална информация Клиентът е претърпял операция и представя болнични документи. Подадено е уведомление към застрахователя.,Health,Surgery,High,Health Claims
"Клиентът съобщава, че Има теч от покрива след буря.",Property,Roof damage,Medium,Property Claims
"Клиентът съобщава, че Медицинска комисия е определила трайна загуба на работоспособност. Необходима е допълнителна проверка на обстоятелствата.",Accident,Permanent disability,Critical,Accident Claims
"Клиентът съобщава, че След теч от тръба е повреден ламинатът.",Property,Burst pipe,Medium,Property Claims
Силен вятър е повредил прозорци и външна изолация. Налични са снимки на увредените части.,Property,Storm,High,Property Claims
"Клиентът съобщава, че Багажът е доставен със закъснение от два дни.",Travel,Delayed baggage,Medium,Travel Claims
По първоначална информация При спиране в задръстване друг автомобил се е ударил отзад. Налични са снимки на увредените части.,Auto,Rear-end collision,High,Motor Claims
По първоначална информация Друг водач е отнел предимство и е ударил автомобила отстрани. Необходима е допълнителна проверка на обстоятелствата.,Auto,Side collision,High,Motor Claims
"В уведомлението е посочено, че Подадена е претенция за възстановяване на разходи за операция. Клиентът представя документи за събитието.",Health,Surgery,Critical,Health Claims
"Клиентът съобщава, че Водопроводна авария е наводнила коридора. Необходима е допълнителна проверка на обстоятелствата.",Property,Burst pipe,High,Property Claims
Клиентът има правни разходи във връзка с претенция. Необходима е допълнителна проверка на обстоятелствата.,Liability,Legal expenses,High,Liability Claims
"Клиентът съобщава, че Има болничен престой след остро заболяване. Необходима е допълнителна проверка на обстоятелствата.",Health,Hospitalization,Medium,Health Claims
"Клиентът съобщава, че В двигателния отсек е възникнал пожар и автомобилът е силно увреден.",Auto,Fire,Critical,Motor Claims
"Клиентът съобщава, че Автомобилът е откраднат през нощта от паркинг. Подадено е уведомление към застрахователя.",Auto,Theft,High,Motor Claims
"Клиентът съобщава, че Причинена е телесна повреда на друго лице. Клиентът представя документи за събитието.",Liability,Bodily injury,High,Liability Claims
Клиентът иска възстановяване на разходи за лекарства.,Health,Medication reimbursement,Low,Health Claims
"В уведомлението е посочено, че Неизвестни лица са проникнали в имота и са откраднали имущество. Налични са снимки на увредените части.",Property,Theft,High,Property Claims
Авиокомпанията е анулирала полета в деня на пътуването. Клиентът представя документи за събитието.,Travel,Flight cancellation,Medium,Travel Claims
По време на пътуване са направени медицински разходи. Необходима е допълнителна проверка на обстоятелствата.,Travel,Medical expenses,Medium,Travel Claims
По първоначална информация Повредена е електроника след късо съединение.,Property,Electrical damage,Low,Property Claims
"Клиентът съобщава, че Автомобилът се е ударил в животно на пътя. Клиентът представя документи за събитието.",Auto,Animal collision,High,Motor Claims
По първоначална информация Автомобилът е изгорял частично след техническа неизправност.,Auto,Fire,Critical,Motor Claims
Токов удар е повредил телевизор и компютър. Клиентът представя документи за събитието.,Property,Electrical damage,Low,Property Claims
"В уведомлението е посочено, че Авиокомпанията е анулирала полета в деня на пътуването. Необходима е допълнителна проверка на обстоятелствата.",Travel,Flight cancellation,High,Travel Claims
По първоначална информация При движение извън населено място е настъпило ПТП със страничен удар. Необходима е допълнителна проверка на обстоятелствата.,Auto,Collision,High,Motor Claims
Апартаментът е наводнен след авария в банята. Необходима е допълнителна проверка на обстоятелствата.,Property,Flood,High,Property Claims
След силна буря има паднали клони върху покрива.,Property,Storm,High,Property Claims
По първоначална информация Куфарът е получен със значително закъснение. Налични са снимки на увредените части.,Travel,Delayed baggage,Low,Travel Claims
"Клиентът съобщава, че Клиентът съобщава за удар отзад и повреден багажник. Подадено е уведомление към застрахователя.",Auto,Rear-end collision,Medium,Motor Claims
По първоначална информация Пътуването е прекъснато поради отменен полет. Подадено е уведомление към застрахователя.,Travel,Flight cancellation,Medium,Travel Claims
По първоначална информация Автомобилът е ударен отзад на светофар и задната броня е счупена.,Auto,Rear-end collision,High,Motor Claims
"В уведомлението е посочено, че Багажът е доставен със закъснение от два дни. Необходима е допълнителна проверка на обстоятелствата.",Travel,Delayed baggage,Medium,Travel Claims
Покривът е повреден след силен вятър.,Property,Roof damage,Medium,Property Claims
"В уведомлението е посочено, че Медицинска комисия е определила трайна загуба на работоспособност. Необходима е допълнителна проверка на обстоятелствата.",Accident,Permanent disability,High,Accident Claims
"В уведомлението е посочено, че Вода от съседен имот е повредила подовата настилка. Необходима е допълнителна проверка на обстоятелствата.",Property,Flood,High,Property Claims
Апартаментът е наводнен след авария в банята. Необходима е допълнителна проверка на обстоятелствата.,Property,Flood,Medium,Property Claims
"В уведомлението е посочено, че Колата е била паркирана в подземен гараж при наводнение. Налични са снимки на увредените части.",Auto,Flood,High,Motor Claims
По първоначална информация Има страничен удар в лявата врата след ПТП.,Auto,Side collision,High,Motor Claims
По първоначална информация След теч от тръба е повреден ламинатът. Налични са снимки на увредените части.,Property,Burst pipe,High,Property Claims
"В уведомлението е посочено, че След удар с диво животно има повредена броня и радиатор.",Auto,Animal collision,Medium,Motor Claims
След инцидент е установена фрактура на крак. Клиентът представя документи за събитието.,Accident,Fracture,High,Accident Claims
"Клиентът съобщава, че Счупено е огледало и има следи от вандализъм. Необходима е допълнителна проверка на обстоятелствата.",Auto,Vandalism,Low,Motor Claims
Къщата е засегната от пожар и има опушени стени. Налични са снимки на увредените части.,Property,Fire,Critical,Property Claims
"В уведомлението е посочено, че Паднали керемиди са причинили щети по тавана. Клиентът представя документи за събитието.",Property,Roof damage,High,Property Claims
"Клиентът съобщава, че Автомобилът е надраскан умишлено с остър предмет.",Auto,Vandalism,Medium,Motor Claims
Полетът е отменен и клиентът е направил допълнителни разходи. Необходима е допълнителна проверка на обстоятелствата.,Travel,Flight cancellation,Medium,Travel Claims
"В уведомлението е посочено, че Клиентът съобщава за удар отзад и повреден багажник. Подадено е уведомление към застрахователя.",Auto,Rear-end collision,Medium,Motor Claims
"В уведомлението е посочено, че При движение извън града е настъпил сблъсък с животно. Необходима е допълнителна проверка на обстоятелствата.",Auto,Animal collision,Medium,Motor Claims
Неизвестно лице е повредило боята и фаровете.,Auto,Vandalism,Medium,Motor Claims
По първоначална информация Полетът е закъснял с повече от шест часа.,Travel,Flight delay,Low,Travel Claims
По първоначална информация Автомобилът е изгорял частично след техническа неизправност. Необходима е допълнителна проверка на обстоятелствата.,Auto,Fire,Critical,Motor Claims
По първоначална информация Пожар е унищожил купето на автомобила.,Auto,Fire,High,Motor Claims
По първоначална информация Багажът не е пристигнал на летището.,Travel,Lost baggage,Medium,Travel Claims
"В уведомлението е посочено, че Клиентът е временно нетрудоспособен след злополука. Подадено е уведомление към застрахователя.",Accident,Temporary disability,Medium,Accident Claims
Клиентът е потърсил лекарска помощ в чужбина. Подадено е уведомление към застрахователя.,Travel,Medical expenses,High,Travel Claims
Пострадал е посетител в обект на застрахования. Клиентът представя документи за събитието.,Liability,Bodily injury,Critical,Liability Claims
По първоначална информация Клиентът е получил счупване на ръка след падане. Необходима е допълнителна проверка на обстоятелствата.,Accident,Fracture,Medium,Accident Claims
"Клиентът съобщава, че Градушка е счупила предното стъкло и е нанесла щети по боята. Необходима е допълнителна проверка на обстоятелствата.",Auto,Hail,Medium,Motor Claims
По първоначална информация Пострадалият не може да работи временно след травма. Необходима е допълнителна проверка на обстоятелствата.,Accident,Temporary disability,Medium,Accident Claims
"В уведомлението е посочено, че Причинена е телесна повреда на друго лице.",Liability,Bodily injury,High,Liability Claims
Извършено е лечение в спешно отделение. Клиентът представя документи за събитието.,Health,Emergency treatment,Critical,Health Claims
"Клиентът съобщава, че Клиентът е бил хоспитализиран за няколко дни. Необходима е допълнителна проверка на обстоятелствата.",Health,Hospitalization,High,Health Claims
"Клиентът съобщава, че След спукана тръба са увредени мебели и стени. Подадено е уведомление към застрахователя.",Property,Flood,High,Property Claims
По първоначална информация Багажът е доставен със закъснение от два дни. Налични са снимки на увредените части.,Travel,Delayed baggage,Medium,Travel Claims
Необходими са адвокатски разходи за защита. Подадено е уведомление към застрахователя.,Liability,Legal expenses,High,Liability Claims
"Клиентът съобщава, че Настъпила е смърт вследствие на злополука.",Accident,Death benefit,Critical,Accident Claims
"Клиентът съобщава, че В жилището е възникнал пожар и са повредени мебели и електроуреди. Подадено е уведомление към застрахователя.",Property,Fire,Critical,Property Claims
По първоначална информация Автомобилът е ударен странично на кръстовище. Клиентът представя документи за събитието.,Auto,Side collision,Medium,Motor Claims
"В уведомлението е посочено, че Клиентът е транспортиран до болница с линейка. Необходима е допълнителна проверка на обстоятелствата.",Travel,Emergency evacuation,Critical,Travel Claims
"В уведомлението е посочено, че Клиентът е останал без багаж при пристигане. Необходима е допълнителна проверка на обстоятелствата.",Travel,Delayed baggage,Low,Travel Claims
"В уведомлението е посочено, че Клиентът е потърсил лекарска помощ в чужбина.",Travel,Medical expenses,Medium,Travel Claims
"Клиентът съобщава, че Пострадалият не може да работи временно след травма. Необходима е допълнителна проверка на обстоятелствата.",Accident,Temporary disability,High,Accident Claims
По първоначална информация По време на пътуване са направени медицински разходи. Налични са снимки на увредените части.,Travel,Medical expenses,Medium,Travel Claims
"В уведомлението е посочено, че Клиентът е отговорен за материални щети към трета страна. Клиентът представя документи за събитието.",Liability,Property damage,High,Liability Claims
"В уведомлението е посочено, че При спиране в задръстване друг автомобил се е ударил отзад. Клиентът представя документи за събитието.",Auto,Rear-end collision,High,Motor Claims
"Клиентът съобщава, че Подадена е претенция за възстановяване на разходи за операция. Необходима е допълнителна проверка на обстоятелствата.",Health,Surgery,High,Health Claims
Пътуването е прекъснато поради отменен полет. Необходима е допълнителна проверка на обстоятелствата.,Travel,Flight cancellation,Medium,Travel Claims
"В уведомлението е посочено, че В двигателния отсек е възникнал пожар и автомобилът е силно увреден.",Auto,Fire,Critical,Motor Claims
"В уведомлението е посочено, че Извършено е амбулаторно лечение. Клиентът представя документи за събитието.",Health,Outpatient treatment,Low,Health Claims
"В уведомлението е посочено, че Вода от съседен имот е повредила подовата настилка. Подадено е уведомление към застрахователя.",Property,Flood,Medium,Property Claims
По първоначална информация По автомобила има множество следи от градушка. Необходима е допълнителна проверка на обстоятелствата.,Auto,Hail,Medium,Motor Claims
Авиокомпанията е анулирала полета в деня на пътуването.,Travel,Flight cancellation,Medium,Travel Claims
"Клиентът съобщава, че Причинена е телесна повреда на друго лице. Клиентът представя документи за събитието.",Liability,Bodily injury,Critical,Liability Claims
"В уведомлението е посочено, че Багажът е доставен със закъснение от два дни.",Travel,Delayed baggage,Medium,Travel Claims
Клиентът е потърсил лекарска помощ в чужбина. Налични са снимки на увредените части.,Travel,Medical expenses,Medium,Travel Claims
По първоначална информация Пострадалият има счупена кост след злополука. Необходима е допълнителна проверка на обстоятелствата.,Accident,Fracture,Medium,Accident Claims
"В уведомлението е посочено, че Клиентът има постоянни увреждания след инцидент. Налични са снимки на увредените части.",Accident,Permanent disability,High,Accident Claims
По първоначална информация След пренапрежение са изгорели електроуреди. Подадено е уведомление към застрахователя.,Property,Electrical damage,Medium,Property Claims
