description,insurance_type,claim_type,severity,department
"Клиентът съобщава, че Пострадалият има счупена кост след злополука. Налични са снимки на увредените части.",Accident,Fracture,High,Accident Claims
"В уведомлението е посочено, че Спукана тръба е причинила щети по стените и тавана. Клиентът представя документи за събитието.",Property,Burst pipe,High,Property Claims
"Клиентът съобщава, че Има взломна кражба и повредена входна врата.",Property,Theft,Medium,Property Claims
По първоначална информация След пренапрежение са изгорели електроуреди. Налични са снимки на увредените части.,Property,Electrical damage,Medium,Property Claims
По първоначална информация Пострадалият има счупена кост след злополука.,Accident,Fracture,High,Accident Claims
При движение извън града е настъпил сблъсък с животно. Необходима е допълнителна проверка на обстоятелствата.,Auto,Animal collision,Medium,Motor Claims
"Клиентът съобщава, че Водопроводна авария е наводнила коридора.",Property,Burst pipe,High,Property Claims
Апартаментът е наводнен след авария в банята. Налични са снимки на увредените части.,Property,Flood,Medium,Property Claims
По първоначална информация Пострадалият има счупена кост след злополука. Необходима е допълнителна проверка на обстоятелствата.,Accident,Fracture,High,Accident Claims
Клиентът иска възстановяване на разходи за лекарства. Клиентът представя документи за събитието.,Health,Medication reimbursement,Low,Health Claims
Клиентът иска възстановяване на разходи за лекарства. Налични са снимки на увредените части.,Health,Medication reimbursement,Low,Health Claims
Апартаментът е наводнен след авария в банята.,Property,Flood,Medium,Property Claims
"Клиентът съобщава, че Автомобилът е изгорял частично след техническа неизправност. Подадено е уведомление към застрахователя.",Auto,Fire,Critical,Motor Claims
"В уведомлението е посочено, че Пожар е унищожил част от кухнята. Налични са снимки на увредените части.",Property,Fire,Critical,Property Claims
Неизвестно лице е повредило боята и фаровете.,Auto,Vandalism,Low,Motor Claims
"Клиентът съобщава, че Има теч от покрива след буря. Подадено е уведомление към застрахователя.",Property,Roof damage,High,Property Claims
"Клиентът съобщава, че Багажът е доставен със закъснение от два дни. Подадено е уведомление към застрахователя.",Travel,Delayed baggage,Medium,Travel Claims
"Клиентът съобщава, че В двигателния отсек е възникнал пожар и автомобилът е силно увреден. Необходима е допълнителна проверка на обстоятелствата.",Auto,Fire,High,Motor Claims
"Клиентът съобщава, че Има болничен престой след остро заболяване. Клиентът представя документи за събитието.",Health,Hospitalization,Medium,Health Claims
"Клиентът съобщава, че Клиентът е потърсил лекарска помощ в чужбина.",Travel,Medical expenses,High,Travel Claims
Клиентът има постоянни увреждания след инцидент.,Accident,Permanent disability,Critical,Accident Claims
По първоначална информация Подадени са документи за лечение в болница. Налични са снимки на увредените части.,Health,Hospitalization,High,Health Claims
По време на пътуване е възникнала нужда от медицинска евакуация.,Travel,Emergency evacuation,High,Travel Claims
"Клиентът съобщава, че След тежка злополука е установена трайна нетрудоспособност.",Accident,Permanent disability,Critical,Accident Claims
По първоначална информация Пострадалият има счупена кост след злополука. Необходима е допълнителна проверка на обстоятелствата.,Accident,Fracture,High,Accident Claims
"Клиентът съобщава, че Клиентът съобщава за удар отзад и повреден багажник. Клиентът представя документи за събитието.",Auto,Rear-end collision,High,Motor Claims
"Клиентът съобщава, че След силна буря има паднали клони върху покрива. Налични са снимки на увредените части.",Property,Storm,High,Property Claims
"В уведомлението е посочено, че Клиентът е получил счупване на ръка след падане. Налични са снимки на увредените части.",Accident,Fracture,Medium,Accident Claims
По първоначална информация Вода е навлязла в купето и е повредила електрониката. Подадено е уведомление към застрахователя.,Auto,Flood,High,Motor Claims
По първоначална информация Клиентът е бил хоспитализиран за няколко дни.,Health,Hospitalization,Medium,Health Claims
Клиентът има правни разходи във връзка с претенция. Клиентът представя документи за събитието.,Liability,Legal expenses,Medium,Liability Claims
Клиентът е посетил специалист и е заплатил преглед.,Health,Outpatient treatment,Medium,Health Claims
По първоначална информация Авиокомпанията е анулирала полета в деня на пътуването. Необходима е допълнителна проверка на обстоятелствата.,Travel,Flight cancellation,Medium,Travel Claims
По първоначална информация Автомобилът е откраднат през нощта от паркинг. Клиентът представя документи за събитието.,Auto,Theft,High,Motor Claims
"Клиентът съобщава, че Вода от съседен имот е повредила подовата настилка. Клиентът представя документи за събитието.",Property,Flood,High,Property Claims
"Клиентът съобщава, че След земетресение има пукнатини по стените. Подадено е уведомление към застрахователя.",Property,Earthquake,High,Property Claims
"Клиентът съобщава, че Куфарът е получен със значително закъснение. Клиентът представя документи за събитието.",Travel,Delayed baggage,Low,Travel Claims
"Клиентът съобщава, че След земетресение има пукнатини по стените.",Property,Earthquake,Critical,Property Claims
По първоначална информация Автомобилът е наводнен след проливен дъжд. Подадено е уведомление към застрахователя.,Auto,Flood,Critical,Motor Claims
"В уведомлението е посочено, че Има допълнителни разходи поради забавен полет. Клиентът представя документи за събитието.",Travel,Flight delay,Medium,Travel Claims
Колата е била паркирана в подземен гараж при наводнение.,Auto,Flood,Critical,Motor Claims
"В уведомлението е посочено, че Автомобилът е наводнен след проливен дъжд. Клиентът представя документи за събитието.",Auto,Flood,High,Motor Claims
Токов удар е повредил телевизор и компютър. Подадено е уведомление към застрахователя.,Property,Electrical damage,Medium,Property Claims
Клиентът е претърпял операция и представя болнични документи. Подадено е уведомление към застрахователя.,Health,Surgery,Critical,Health Claims
"В уведомлението е посочено, че След земетресение има пукнатини по стените. Налични са снимки на увредените части.",Property,Earthquake,Critical,Property Claims
Клиентът е пропуснал връзка заради закъснение. Необходима е допълнителна проверка на обстоятелствата.,Travel,Flight delay,Low,Travel Claims
По първоначална информация Автомобилът се е ударил в животно на пътя. Необходима е допълнителна проверка на обстоятелствата.,Auto,Animal collision,Medium,Motor Claims
Откраднати са гуми и джанти от автомобила. Налични са снимки на увредените части.,Auto,Theft,Critical,Motor Claims
Клиентът е потърсил лекарска помощ в чужбина.,Travel,Medical expenses,Medium,Travel Claims
Сградата е получила конструктивни повреди след трус. Подадено е уведомление към застрахователя.,Property,Earthquake,High,Property Claims
По първоначална информация След теч от тръба е повреден ламинатът. Клиентът представя документи за събитието.,Property,Burst pipe,High,Property Claims
По първоначална информация Автомобилът е ударен странично на кръстовище. Клиентът представя документи за събитието.,Auto,Side collision,Medium,Motor Claims
"В уведомлението е посочено, че Куфарът е получен със значително закъснение. Налични са снимки на увредените части.",Travel,Delayed baggage,Low,Travel Claims
"В уведомлението е посочено, че Вода от съседен имот е повредила подовата настилка.",Property,Flood,High,Property Claims
Подадена е претенция за възстановяване на разходи за операция. Необходима е допълнителна проверка на обстоятелствата.,Health,Surgery,Critical,Health Claims
"Клиентът съобщава, че Има паднала мазилка и напукани тавани след земетресение. Подадено е уведомление към застрахователя.",Property,Earthquake,Critical,Property Claims
Пожар е унищожил част от кухнята.,Property,Fire,High,Property Claims
По първоначална информация Апартаментът е наводнен след авария в банята. Клиентът представя документи за събитието.,Property,Flood,High,Property Claims
По първоначална информация Причинена е телесна повреда на друго лице. Подадено е уведомление към застрахователя.,Liability,Bodily injury,High,Liability Claims
"Клиентът съобщава, че Покривът е повреден след силен вятър. Подадено е уведомление към застрахователя.",Property,Roof damage,Medium,Property Claims
Водопроводна авария е наводнила коридора. Необходима е допълнителна проверка на обстоятелствата.,Property,Burst pipe,Medium,Property Claims
По първоначална информация След теч от тръба е повреден ламинатът.,Property,Burst pipe,High,Property Claims
"Клиентът съобщава, че След силна градушка автомобилът има вдлъбнатини по капака и покрива. Налични са снимки на увредените части.",Auto,Hail,Low,Motor Claims
Клиентът има постоянни увреждания след инцидент. Необходима е допълнителна проверка на обстоятелствата.,Accident,Permanent disability,Critical,Accident Claims
Автомобилът е изгорял частично след техническа неизправност.,Auto,Fire,Critical,Motor Claims
По първоначална информация След силна буря има паднали клони върху покрива. Подадено е уведомление към застрахователя.,Property,Storm,High,Property Claims
"В уведомлението е посочено, че Клиентът има постоянни увреждания след инцидент. Налични са снимки на увредените части.",Accident,Permanent disability,Critical,Accident Claims
"В уведомлението е посочено, че Автомобилът се е ударил в животно на пътя. Налични са снимки на увредените части.",Auto,Animal collision,High,Motor Claims
"Клиентът съобщава, че Пострадалият има счупена кост след злополука.",Accident,Fracture,High,Accident Claims
"В уведомлението е посочено, че Пожар е унищожил купето на автомобила.",Auto,Fire,High,Motor Claims
"В уведомлението е посочено, че Сградата е получила конструктивни повреди след трус. Необходима е допълнителна проверка на обстоятелствата.",Property,Earthquake,Critical,Property Claims
След сблъсък между два автомобила има щети по калника и фара. Необходима е допълнителна проверка на обстоятелствата.,Auto,Collision,Medium,Motor Claims
Счупено е огледало и има следи от вандализъм. Подадено е уведомление към застрахователя.,Auto,Vandalism,Medium,Motor Claims
"В уведомлението е посочено, че Куфарът на клиента е изгубен по време на полет. Необходима е допълнителна проверка на обстоятелствата.",Travel,Lost baggage,Medium,Travel Claims
След силна градушка автомобилът има вдлъбнатини по капака и покрива. Налични са снимки на увредените части.,Auto,Hail,Low,Motor Claims
По първоначална информация Спукана тръба е причинила щети по стените и тавана.,Property,Burst pipe,Medium,Property Claims
"Клиентът съобщава, че При спиране в задръстване друг автомобил се е ударил отзад. Налични са снимки на увредените части.",Auto,Rear-end collision,High,Motor Claims
"В уведомлението е посочено, че Пострадалият има счупена кост след злополука. Клиентът представя документи за събитието.",Accident,Fracture,Medium,Accident Claims
"Клиентът съобщава, че Пострадалият има счупена кост след злополука. Клиентът представя документи за събитието.",Accident,Fracture,High,Accident Claims
"В уведомлението е посочено, че Спукана тръба е причинила щети по стените и тавана. Подадено е уведомление към застрахователя.",Property,Burst pipe,High,Property Claims
"Клиентът съобщава, че В двигателния отсек е възникнал пожар и автомобилът е силно увреден. Клиентът представя документи за събитието.",Auto,Fire,High,Motor Claims
Извършено е лечение в спешно отделение. Клиентът представя документи за събитието.,Health,Emergency treatment,Critical,Health Claims
"Клиентът съобщава, че Застрахованият е причинил щети на чуждо имущество.",Liability,Property damage,High,Liability Claims
"Клиентът съобщава, че Клиентът е получил счупване на ръка след падане. Подадено е уведомление към застрахователя.",Accident,Fracture,High,Accident Claims
Има допълнителни разходи поради забавен полет. Клиентът представя документи за събитието.,Travel,Flight delay,Low,Travel Claims
"В уведомлението е посочено, че Има болничен престой след остро заболяване. Клиентът представя документи за събитието.",Health,Hospitalization,High,Health Claims
"Клиентът съобщава, че Къщата е засегната от пожар и има опушени стени. Клиентът представя документи за събитието.",Property,Fire,High,Property Claims
Предното стъкло е спукано от камък по време на движение.,Auto,Glass damage,Low,Motor Claims
"Клиентът съобщава, че Паднали керемиди са причинили щети по тавана. Подадено е уведомление към застрахователя.",Property,Roof damage,Medium,Property Claims
"Клиентът съобщава, че Буря е нанесла щети по фасадата на къщата. Налични са снимки на увредените части.",Property,Storm,High,Property Claims
По първоначална информация Колата е била паркирана в подземен гараж при наводнение. Клиентът представя документи за събитието.,Auto,Flood,Critical,Motor Claims
"В уведомлението е посочено, че Счупено е страничното стъкло на автомобила. Клиентът представя документи за събитието.",Auto,Glass damage,Low,Motor Claims
"Клиентът съобщава, че Има пукнатина на челното стъкло след удар от предмет. Необходима е допълнителна проверка на обстоятелствата.",Auto,Glass damage,Low,Motor Claims
"Клиентът съобщава, че Подадена е претенция за смъртно обезщетение. Необходима е допълнителна проверка на обстоятелствата.",Accident,Death benefit,Critical,Accident Claims
"В уведомлението е посочено, че От жилището са откраднати техника и лични вещи.",Property,Theft,Medium,Property Claims
"Клиентът съобщава, че Извършена е хирургична интервенция по медицински показания.",Health,Surgery,Critical,Health Claims
"В уведомлението е посочено, че Предното стъкло е спукано от камък по време на движение. Налични са снимки на увредените части.",Auto,Glass damage,Low,Motor Claims
След инцидент е установена фрактура на крак. Необходима е допълнителна проверка на обстоятелствата.,Accident,Fracture,Medium,Accident Claims
При ремонт са повредени вещи на трето лице. Необходима е допълнителна проверка на обстоятелствата.,Liability,Property damage,Medium,Liability Claims
По първоначална информация Пострадал е посетител в обект на застрахования. Налични са снимки на увредените части.,Liability,Bodily injury,High,Liability Claims
По първоначална информация Представени са фактури за консултация и изследвания. Клиентът представя документи за събитието.,Health,Outpatient treatment,Low,Health Claims
По първоначална информация Необходима е спешна евакуация по медицински причини. Необходима е допълнителна проверка на обстоятелствата.,Travel,Emergency evacuation,Critical,Travel Claims
"Клиентът съобщава, че Къщата е засегната от пожар и има опушени стени.",Property,Fire,High,Property Claims
Неизвестни лица са проникнали в имота и са откраднали имущество. Налични са снимки на увредените части.,Property,Theft,Medium,Property Claims
Авиокомпанията е анулирала полета в деня на пътуването. Налични са снимки на увредените части.,Travel,Flight cancellation,High,Travel Claims
Друг водач е отнел предимство и е ударил автомобила отстрани. Необходима е допълнителна проверка на обстоятелствата.,Auto,Side collision,High,Motor Claims
"Клиентът съобщава, че Клиентът е транспортиран до болница с линейка.",Travel,Emergency evacuation,High,Travel Claims
По първоначална информация Откраднати са гуми и джанти от автомобила. Подадено е уведомление към застрахователя.,Auto,Theft,Critical,Motor Claims
При спиране в задръстване друг автомобил се е ударил отзад. Клиентът представя документи за събитието.,Auto,Rear-end collision,Medium,Motor Claims
Градушка е счупила предното стъкло и е нанесла щети по боята.,Auto,Hail,Medium,Motor Claims
"В уведомлението е посочено, че Клиентът е пропуснал връзка заради закъснение. Налични са снимки на увредените части.",Travel,Flight delay,Medium,Travel Claims
"В уведомлението е посочено, че Има допълнителни разходи поради забавен полет. Необходима е допълнителна проверка на обстоятелствата.",Travel,Flight delay,Medium,Travel Claims
"Клиентът съобщава, че След силна градушка автомобилът има вдлъбнатини по капака и покрива.",Auto,Hail,Medium,Motor Claims
