description,insurance_type,claim_type,severity,department
"Клиентът съобщава, че Автомобилът се е ударил в животно на пътя.",Auto,Animal collision,High,Motor Claims
"В уведомлението е посочено, че Счупено е огледало и има следи от вандализъм. Подадено е уведомление към застрахователя.",Auto,Vandalism,Low,Motor Claims
"Клиентът съобщава, че Багажът е доставен със закъснение от два дни. Налични са снимки на увредените части.",Travel,Delayed baggage,Medium,Travel Claims
По първоначална информация Неизвестни лица са проникнали в имота и са откраднали имущество.,Property,Theft,High,Property Claims
Застрахованият е причинил щети на чуждо имущество. Необходима е допълнителна проверка на обстоятелствата.,Liability,Property damage,High,Liability Claims
"В уведомлението е посочено, че Причинена е телесна повреда на друго лице. Подадено е уведомление към застрахователя.",Liability,Bodily injury,Critical,Liability Claims
Представени са фактури за консултация и изследвания. Подадено е уведомление към застрахователя.,Health,Outpatient treatment,Medium,Health Claims
По първоначална информация След сблъсък между два автомобила има щети по калника и фара. Подадено е уведомление към застрахователя.,Auto,Collision,Medium,Motor Claims
По първоначална информация След спукана тръба са увредени мебели и стени. Подадено е уведомление към застрахователя.,Property,Flood,Medium,Property Claims
"В уведомлението е посочено, че При ремонт са повредени вещи на трето лице.",Liability,Property damage,High,Liability Claims
Възникнали са съдебни разноски по застрахователен спор. Налични са снимки на увредените части.,Liability,Legal expenses,High,Liability Claims
Има паднала мазилка и напукани тавани след земетресение.,Property,Earthquake,Critical,Property Claims
"В уведомлението е посочено, че Настъпила е смърт вследствие на злополука. Необходима е допълнителна проверка на обстоятелствата.",Accident,Death benefit,Critical,Accident Claims
По първоначална информация Къщата е засегната от пожар и има опушени стени. Налични са снимки на увредените части.,Property,Fire,Critical,Property Claims
"В уведомлението е посочено, че Вода е навлязла в купето и е повредила електрониката. Клиентът представя документи за събитието.",Auto,Flood,Critical,Motor Claims
Токов удар е повредил телевизор и компютър. Клиентът представя документи за събитието.,Property,Electrical damage,Low,Property Claims
"Клиентът съобщава, че Автомобилът е изгорял частично след техническа неизправност. Клиентът представя документи за събитието.",Auto,Fire,High,Motor Claims
По първоначална информация След инцидент е установена фрактура на крак.,Accident,Fracture,Medium,Accident Claims
"Клиентът съобщава, че Автомобилът е откраднат през нощта от паркинг. Необходима е допълнителна проверка на обстоятелствата.",Auto,Theft,High,Motor Claims
След земетресение има пукнатини по стените. Клиентът представя документи за събитието.,Property,Earthquake,Critical,Property Claims
"Клиентът съобщава, че Причинена е телесна повреда на друго лице. Налични са снимки на увредените части.",Liability,Bodily injury,High,Liability Claims
"Клиентът съобщава, че Извършена е хирургична интервенция по медицински показания. Подадено е уведомление към застрахователя.",Health,Surgery,Critical,Health Claims
По първоначална информация Клиентът има постоянни увреждания след инцидент. Необходима е допълнителна проверка на обстоятелствата.,Accident,Permanent disability,High,Accident Claims
"В уведомлението е посочено, че Клиентът е потърсил лекарска помощ в чужбина.",Travel,Medical expenses,Medium,Travel Claims
"Клиентът съобщава, че Неизвестно лице е повредило боята и фаровете. Подадено е уведомление към застрахователя.",Auto,Vandalism,Low,Motor Claims
"Клиентът съобщава, че Представени са фактури за консултация и изследвания. Клиентът представя документи за събитието.",Health,Outpatient treatment,Low,Health Claims
По първоначална информация Куфарът на клиента е изгубен по време на полет. Клиентът представя документи за събитието.,Travel,Lost baggage,Medium,Travel Claims
"Клиентът съобщава, че Авиокомпанията е анулирала полета в деня на пътуването. Клиентът представя документи за събитието.",Travel,Flight cancellation,High,Travel Claims
По автомобила има множество следи от градушка. Клиентът представя документи за събитието.,Auto,Hail,Medium,Motor Claims
"В уведомлението е посочено, че По автомобила има множество следи от градушка. Подадено е уведомление към застрахователя.",Auto,Hail,Low,Motor Claims
"Клиентът съобщава, че Има допълнителни разходи поради забавен полет. Налични са снимки на увредените части.",Travel,Flight delay,Low,Travel Claims
"Клиентът съобщава, че След спукана тръба са увредени мебели и стени. Необходима е допълнителна проверка на обстоятелствата.",Property,Flood,High,Property Claims
"Клиентът съобщава, че Подадена е претенция за възстановяване на разходи за операция. Клиентът представя документи за събитието.",Health,Surgery,Critical,Health Claims
"Клиентът съобщава, че Застрахованото лице е починало след тежък инцидент. Подадено е уведомление към застрахователя.",Accident,Death benefit,Critical,Accident Claims
Авиокомпанията е загубила регистрирания багаж.,Travel,Lost baggage,Medium,Travel Claims
По първоначална информация Има болничен престой след остро заболяване. Необходима е допълнителна проверка на обстоятелствата.,Health,Hospitalization,High,Health Claims
"Клиентът съобщава, че Има взломна кражба и повредена входна врата. Налични са снимки на увредените части.",Property,Theft,Medium,Property Claims
По първоначална информация Покривът е повреден след силен вятър. Налични са снимки на увредените части.,Property,Roof damage,High,Property Claims
Клиентът е приет по спешност след внезапно влошаване. Клиентът представя документи за събитието.,Health,Emergency treatment,High,Health Claims
"Клиентът съобщава, че Полетът е закъснял с повече от шест часа. Подадено е уведомление към застрахователя.",Travel,Flight delay,Low,Travel Claims
По първоначална информация Водачът е изгубил контрол и се е ударил в мантинела в Пловдив. Клиентът представя документи за събитието.,Auto,Collision,Medium,Motor Claims
Клиентът иска възстановяване на разходи за лекарства. Подадено е уведомление към застрахователя.,Health,Medication reimbursement,Low,Health Claims
По първоначална информация Застрахованият е причинил щети на чуждо имущество. Налични са снимки на увредените части.,Liability,Property damage,Medium,Liability Claims
"В уведомлението е посочено, че Вода от съседен имот е повредила подовата настилка. Подадено е уведомление към застрахователя.",Property,Flood,High,Property Claims
Автомобилът се е ударил в животно на пътя. Налични са снимки на увредените части.,Auto,Animal collision,High,Motor Claims
"Клиентът съобщава, че Сградата е получила конструктивни повреди след трус. Клиентът представя документи за събитието.",Property,Earthquake,High,Property Claims
След теч от тръба е повреден ламинатът. Налични са снимки на увредените части.,Property,Burst pipe,High,Property Claims
"В уведомлението е посочено, че Градушка е счупила предното стъкло и е нанесла щети по боята. Необходима е допълнителна проверка на обстоятелствата.",Auto,Hail,Low,Motor Claims
"В уведомлението е посочено, че Има пукнатина на челното стъкло след удар от предмет. Клиентът представя документи за събитието.",Auto,Glass damage,Medium,Motor Claims
По първоначална информация Има теч от покрива след буря.,Property,Roof damage,Medium,Property Claims
"Клиентът съобщава, че Колата е била паркирана в подземен гараж при наводнение. Налични са снимки на увредените части.",Auto,Flood,Critical,Motor Claims
По първоначална информация Багажът е доставен със закъснение от два дни. Необходима е допълнителна проверка на обстоятелствата.,Travel,Delayed baggage,Medium,Travel Claims
По първоначална информация Има страничен удар в лявата врата след ПТП.,Auto,Side collision,High,Motor Claims
По първоначална информация Авиокомпанията е загубила регистрирания багаж. Налични са снимки на увредените части.,Travel,Lost baggage,Medium,Travel Claims
"Клиентът съобщава, че Пожар е унищожил купето на автомобила. Необходима е допълнителна проверка на обстоятелствата.",Auto,Fire,High,Motor Claims
"В уведомлението е посочено, че Клиентът е получил счупване на ръка след падане. Клиентът представя документи за събитието.",Accident,Fracture,Medium,Accident Claims
По първоначална информация Багажът не е пристигнал на летището.,Travel,Lost baggage,High,Travel Claims
Пострадалият има счупена кост след злополука. Необходима е допълнителна проверка на обстоятелствата.,Accident,Fracture,Medium,Accident Claims
Пострадалият има счупена кост след злополука. Клиентът представя документи за събитието.,Accident,Fracture,High,Accident Claims
"В уведомлението е посочено, че При движение извън града е настъпил сблъсък с животно. Подадено е уведомление към застрахователя.",Auto,Animal collision,Medium,Motor Claims
"Клиентът съобщава, че Неизвестни лица са проникнали в имота и са откраднали имущество. Налични са снимки на увредените части.",Property,Theft,Medium,Property Claims
"В уведомлението е посочено, че Клиентът е получил лечение в болница в чужбина. Клиентът представя документи за събитието.",Travel,Medical expenses,Medium,Travel Claims
"В уведомлението е посочено, че По автомобила има множество следи от градушка.",Auto,Hail,Low,Motor Claims
"В уведомлението е посочено, че Има паднала мазилка и напукани тавани след земетресение. Налични са снимки на увредените части.",Property,Earthquake,Critical,Property Claims
По първоначална информация Автомобилът е изгорял частично след техническа неизправност. Клиентът представя документи за събитието.,Auto,Fire,Critical,Motor Claims
Неизвестни лица са проникнали в имота и са откраднали имущество. Подадено е уведомление към застрахователя.,Property,Theft,High,Property Claims
Подадени са документи за лечение в болница. Налични са снимки на увредените части.,Health,Hospitalization,Medium,Health Claims
Автомобилът се е ударил в животно на пътя. Налични са снимки на увредените части.,Auto,Animal collision,High,Motor Claims
Силен вятър е повредил прозорци и външна изолация. Клиентът представя документи за събитието.,Property,Storm,High,Property Claims
"Клиентът съобщава, че Счупено е огледало и има следи от вандализъм. Подадено е уведомление към застрахователя.",Auto,Vandalism,Medium,Motor Claims
Клиентът е останал без багаж при пристигане. Необходима е допълнителна проверка на обстоятелствата.,Travel,Delayed baggage,Medium,Travel Claims
"Клиентът съобщава, че Счупено е страничното стъкло на автомобила.",Auto,Glass damage,Medium,Motor Claims
Клиентът е транспортиран до болница с линейка. Необходима е допълнителна проверка на обстоятелствата.,Travel,Emergency evacuation,High,Travel Claims
Извършено е амбулаторно лечение.,Health,Outpatient treatment,Medium,Health Claims
След теч от тръба е повреден ламинатът. Подадено е уведомление към застрахователя.,Property,Burst pipe,High,Property Claims
"Клиентът съобщава, че Оказана е спешна медицинска помощ. Подадено е уведомление към застрахователя.",Health,Emergency treatment,High,Health Claims
По първоначална информация Клиентът е посетил специалист и е заплатил преглед. Необходима е допълнителна проверка на обстоятелствата.,Health,Outpatient treatment,Low,Health Claims
"Клиентът съобщава, че Има болничен престой след остро заболяване. Необходима е допълнителна проверка на обстоятелствата.",Health,Hospitalization,Medium,Health Claims
Пострадалият има счупена кост след злополука.,Accident,Fracture,High,Accident Claims
"В уведомлението е посочено, че Клиентът е приет по спешност след внезапно влошаване. Налични са снимки на увредените части.",Health,Emergency treatment,High,Health Claims
"Клиентът съобщава, че Клиентът е пропуснал връзка заради закъснение.",Travel,Flight delay,Medium,Travel Claims
"Клиентът съобщава, че По време на пътуване са направени медицински разходи.",Travel,Medical expenses,Medium,Travel Claims
След спукана тръба са увредени мебели и стени. Подадено е уведомление към застрахователя.,Property,Flood,Medium,Property Claims
"В уведомлението е посочено, че Клиентът е приет по спешност след внезапно влошаване. Налични са снимки на увредените части.",Health,Emergency treatment,High,Health Claims
"В уведомлението е посочено, че Автомобилът е изгорял частично след техническа неизправност. Клиентът представя документи за събитието.",Auto,Fire,High,Motor Claims
"Клиентът съобщава, че Апартаментът е наводнен след авария в банята. Налични са снимки на увредените части.",Property,Flood,Medium,Property Claims
"В уведомлението е посочено, че По време на пътуване е възникнала нужда от медицинска евакуация. Подадено е уведомление към застрахователя.",Travel,Emergency evacuation,High,Travel Claims
По първоначална информация Водопроводна авария е наводнила коридора. Клиентът представя документи за събитието.,Property,Burst pipe,Medium,Property Claims
"Клиентът съобщава, че Подадени са документи за лечение в болница. Необходима е допълнителна проверка на обстоятелствата.",Health,Hospitalization,High,Health Claims
По първоначална информация Има страничен удар в лявата врата след ПТП.,Auto,Side collision,High,Motor Claims
"В уведомлението е посочено, че Клиентът е бил хоспитализиран за няколко дни. Клиентът представя документи за събитието.",Health,Hospitalization,Medium,Health Claims
По първоначална информация Полетът е закъснял с повече от шест часа. Необходима е допълнителна проверка на обстоятелствата.,Travel,Flight delay,Low,Travel Claims
Счупено е огледало и има следи от вандализъм. Необходима е допълнителна проверка на обстоятелствата.,Auto,Vandalism,Medium,Motor Claims
"Клиентът съобщава, че Пътуването е прекъснато поради отменен полет.",Travel,Flight cancellation,High,Travel Claims
"В уведомлението е посочено, че Неизвестни лица са проникнали в имота и са откраднали имущество. Налични са снимки на увредените части.",Property,Theft,High,Property Claims
"Клиентът съобщава, че Автомобилът се е ударил в животно на пътя.",Auto,Animal collision,Medium,Motor Claims
"В уведомлението е посочено, че Клиентът съобщава за кражба на автомобила пред блока. Клиентът представя документи за събитието.",Auto,Theft,Critical,Motor Claims
"Клиентът съобщава, че Клиентът е пропуснал връзка заради закъснение. Клиентът представя документи за събитието.",Travel,Flight delay,Medium,Travel Claims
"Клиентът съобщава, че Покривът е повреден след силен вятър.",Property,Roof damage,High,Property Claims
"Клиентът съобщава, че Токов удар е повредил телевизор и компютър.",Property,Electrical damage,Medium,Property Claims
По първоначална информация След земетресение има пукнатини по стените. Налични са снимки на увредените части.,Property,Earthquake,Critical,Property Claims
По първоначална информация Автомобилът е наводнен след проливен дъжд. Необходима е допълнителна проверка на обстоятелствата.,Auto,Flood,Critical,Motor Claims
Представени са фактури за консултация и изследвания. Подадено е уведомление към застрахователя.,Health,Outpatient treatment,Low,Health Claims
Пострадал е посетител в обект на застрахования.,Liability,Bodily injury,High,Liability Claims
По първоначална информация Автомобилът е изгорял частично след техническа неизправност.,Auto,Fire,High,Motor Claims
След удар с диво животно има повредена броня и радиатор. Клиентът представя документи за събитието.,Auto,Animal collision,High,Motor Claims
"В уведомлението е посочено, че Клиентът иска възстановяване на разходи за лекарства. Клиентът представя документи за събитието.",Health,Medication reimbursement,Low,Health Claims
"Клиентът съобщава, че Предното стъкло е спукано от камък по време на движение. Налични са снимки на увредените части.",Auto,Glass damage,Medium,Motor Claims
По първоначална информация Автомобилът е ударен отзад пред жилищен блок и има повреди по бронята. Клиентът представя документи за събитието.,Auto,Collision,Medium,Motor Claims
"В уведомлението е посочено, че Токов удар е повредил телевизор и компютър. Налични са снимки на увредените части.",Property,Electrical damage,Low,Property Claims
